CHAR ID;CHAR NAMES;KEYS;Turkish;English;Spanish;Portuguese;German;French;Italian;Polish;Russian;ChineseSimplified;ChineseTraditional;Japanese;Korean;Indian;Arabic;Bengali;Indonesian;Thai;Vietnamese
1;Althea;imReallyBored;Hmm. Çok sıkıldım.;Hmm. I’m so bored right now.;Hmm. Estoy tan aburrida ahora mismo.;Hmm. Estou tão entediada agora.;Hmm. Mir ist gerade so langweilig.;Hmm. Je m’ennuie tellement en ce moment.;Hmm. Mi annoio così tanto adesso.;Hmm. Jestem teraz tak znudzona.;Хм. Мне сейчас так скучно.;嗯。我现在好无聊。;嗯。我現在好無聊。;うーん。今とても退屈しています。;흠. 지금 너무 지루해요.;हम्म। मैं अभी बहुत ऊब गई हूँ।;هممم. أشعر بالملل الشديد الآن.;হুম। আমি এখন খুবই বিরক্ত।;Hmm. Saya sangat bosan sekarang.;อืมม ฉันเบื่อมากตอนนี้;Hmm. Tôi đang rất chán ngay bây giờ.
1;Althea;howLongShouldIWalk;Birşeyler olması için daha ne kadar yürümem gerek?;How long do I have to walk before something actually happens?;¿Cuánto tiempo tengo que caminar antes de que pase algo?;Quanto tempo eu tenho que andar antes que algo realmente aconteça?;Wie lange muss ich laufen, bevor etwas passiert?;Combien de temps dois-je marcher avant que quelque chose se passe?;Quanto tempo devo camminare prima che succeda qualcosa?;Jak długo muszę chodzić, zanim coś się stanie?;Как долго мне нужно идти, прежде чем что-то случится?;我需要走多久才能发生点什么？;我需要走多久才能發生點什麼？;どれくらい歩けば何かが起こるのでしょうか？;얼마나 걸어야 무언가가 일어날까요?;मुझे कुछ होने से पहले कितना चलना होगा?;كم من الوقت علي أن أمشي قبل أن يحدث شيء ما؟;কিছু ঘটার আগে আমাকে কতক্ষণ হাঁটতে হবে?;Berapa lama saya harus berjalan sebelum sesuatu benar-benar terjadi?;ฉันต้องเดินอีกนานแค่ไหนก่อนที่จะมีบางอย่างเกิดขึ้น?;Tôi phải đi bao lâu trước khi có chuyện gì đó xảy ra?
;;portalOpens;*Bir portal açılır ve başka bir boyuta giden bir geçit ortaya çıkar.*;*A portal opens, revealing a gateway to another dimension.*;*Un portal se abre, revelando una puerta a otra dimensión.*;*Um portal se abre, revelando um portal para outra dimensão.*;*Ein Portal öffnet sich und enthüllt ein Tor zu einer anderen Dimension.*;*Un portail s’ouvre, révélant un passage vers une autre dimension.*;*Si apre un portale, rivelando un passaggio verso un’altra dimensione.*;*Otwiera się portal, ukazując przejście do innego wymiaru.*;*Открывается портал, открывающий путь в другое измерение.*;*一个传送门打开，显现出通往另一个维度的入口。*;*一個傳送門打開，顯現出通往另一個維度的入口。*;*ポータルが開き、別の次元への入り口が現れる。*;*포털이 열리고 다른 차원으로 가는 관문이 나타납니다.*;*एक पोर्टल खुलता है, जो एक और आयाम के लिए एक प्रवेश द्वार का खुलासा करता है।*;*يفتح بوابة تكشف عن بوابة إلى بُعد آخر.*;*একটি পোর্টাল খোলে, যা অন্য একটি মাত্রায় যাওয়ার একটি প্রবেশপথ প্রকাশ করে।*;*Sebuah portal terbuka, memperlihatkan gerbang ke dimensi lain.*;*พอร์ทัลเปิดเผยประตูสู่มิติอื่น*;*Một cánh cổng mở ra, tiết lộ lối vào đến một chiều không gian khác.*
1;Althea;isThatAPicture;Bu da ne? Bir resim mi?;What’s this? A picture?;¿Qué es esto? ¿Una imagen?;O que é isso? Uma imagem?;Was ist das? Ein Bild?;Qu'est-ce que c'est? Une image?;Cos'è questo? Una foto?;Co to jest? Obraz?;Что это? Картина?;这是什么？一张图片？;這是什麼？一張圖片？;これは何？絵？;이게 뭐야? 그림?;यह क्या है? एक चित्र?;ما هذا؟ صورة؟;এটা কি? একটি ছবি?;Apa ini? Sebuah gambar?;นี่คืออะไร? รูปภาพ?;Cái gì đây? Một bức tranh?
1;Althea;noWaitIKnow;Hayır, bekle biraz! Bu bir resim değil!;No, wait! I know! This isn’t a picture!;¡No, espera! ¡Lo sé! ¡Esto no es una imagen!;Não, espera! Eu sei! Isso não é uma imagem!;Nein, warte! Ich weiß! Das ist kein Bild!;Non, attends! Je sais! Ce n'est pas une image!;No, aspetta! Lo so! Non è una foto!;Nie, czekaj! Wiem! To nie jest obraz!;Нет, подожди! Я знаю! Это не картина!;不，等等！我知道！这不是一张图片！;不，等等！我知道！這不是一張圖片！;いいえ、待って！これは絵じゃない！;아니야, 기다려! 이건 그림이 아니야!;नहीं, रुको! मैं जानता हूँ! यह एक चित्र नहीं है!;لا، انتظر! أنا أعرف! هذه ليست صورة!;না, অপেক্ষা কর! আমি জানি! এটা ছবি নয়!;Tidak, tunggu! Aku tahu! Ini bukan gambar!;ไม่, รอเดี๋ยว! ฉันรู้! นี่ไม่ใช่รูปภาพ!;Không, đợi đã! Tôi biết! Đây không phải là một bức tranh!
1;Althea;itsMagicalPicture;*Yavaşça* Bu büyüülüü bir resiiiim!;*Slowly* It’s a maaagical pictureee!;*Lentamente* ¡Es una imagen mágicaaa!;*Lentamente* É uma imagem mágicaaa!;*Langsam* Es ist ein maaaaagisches Bild!;*Lentement* C'est une image maaagique!;*Lentamente* È una foto maaaagica!;*Powoli* To jest maaaagiczny obraz!;*Медленно* Это маааагическая картина!;*慢慢地* 这是一张魔法图片！;*慢慢地* 這是一張魔法圖片！;*ゆっくりと* これは魔法の絵です！;*천천히* 이건 마법의 그림이야!;*धीरे से* यह एक जादुई चित्र है!;*ببطء* إنها صورة ماااجية!;*ধীরে ধীরে* এটি একটি যাদুকরী ছবি!;*Perlahan* Ini adalah gambar ajaib!;*ช้าๆ* นี่คือภาพวิเศษ!;*Từ từ* Đây là một bức tranh ma thuật!
;;closerToPortal;*Yavaşça portala yaklaşır*;*She steps closer to the portal*;*Se acerca lentamente al portal*;*Ela se aproxima lentamente do portal*;*Sie tritt langsam näher an das Portal heran*;*Elle s'approche lentement du portail*;*Si avvicina lentamente al portale*;*Powoli zbliża się do portalu*;*Она медленно приближается к порталу*;*慢慢地走近传送门*;*慢慢地走近傳送門*;*ゆっくりとポータルに近づく*;*천천히 포털에 다가간다*;*धीरे-धीरे पोर्टल के पास जाती है*;*تقترب ببطء من البوابة*;*ধীরে ধীরে পোর্টালের কাছে যায়*;*Dia melangkah lebih dekat ke portal*;*ค่อยๆ ก้าวเข้าไปใกล้พอร์ทัล*;*Cô ấy bước lại gần cổng hơn*
1;Althea;itsDefinitelyMagical;*Heyecanlı* Biliyordum! Yüzde yüz haklıyım! Bu kesinlikle büyülü bir resim!;*Excitedly* I knew it! I was totally right—it’s definitely a magical picture!;*Emocionada* ¡Lo sabía! ¡Tenía toda la razón, es definitivamente una imagen mágica!;*Animadamente* Eu sabia! Eu estava totalmente certo - é definitivamente uma imagem mágica!;*Aufgeregt* Ich wusste es! Ich hatte völlig recht—es ist definitiv ein magisches Bild!;*Avec excitation* Je le savais! J'avais totalement raison, c'est définitivement une image magique!;*Eccitata* Lo sapevo! Avevo totalmente ragione—è decisamente un'immagine magica!;*Podekscytowana* Wiedziałam! Miałam całkowitą rację—To jest na pewno magiczny obraz!;*Возбуждённо* Я знала! Я была совершенно права—это точно магическая картина!;*兴奋地* 我知道！我是完全正确的—这绝对是一张魔法图片！;*興奮地* 我知道！我是完全正確的—這絕對是一張魔法圖片！;*興奮して* 私は知っていた！私は完全に正しかった—これは確かに魔法の絵です！;*흥분하며* 알았어! 완전히 맞았어—이건 분명히 마법의 그림이야!;*उत्साहित होकर* मुझे पता था! मैं पूरी तरह सही था—यह निश्चित रूप से एक जादुई चित्र है!;*بحماس* كنت أعرف ذلك! كنت محقًا تمامًا—إنها بالتأكيد صورة سحرية!;*উত্তেজিত হয়ে* আমি জানতাম! আমি পুরোপুরি সঠিক ছিলাম—এটি অবশ্যই একটি যাদুকরী ছবি!;*Dengan bersemangat* Saya tahu itu! Saya benar-benar benar—ini pasti gambar ajaib!;*ตื่นเต้น* ฉันรู้แล้ว! ฉันถูกต้อง—นี่เป็นภาพวิเศษแน่นอน!;*Hào hứng* Tôi đã biết! Tôi hoàn toàn đúng—đây chắc chắn là một bức tranh ma thuật!
;;sheIsDefinitelyWrong;*Yüzde yüz haksız ^^*;*She is totally wrong ^^*;*Ella está completamente equivocada ^^*;*Ela está totalmente errada ^^*;*Sie liegt völlig falsch ^^*;*Elle a totalement tort ^^*;*Lei è totalmente sbagliata ^^*;*Ona jest całkowicie w błędzie ^^*;*Она совершенно не права ^^*;*她完全错了^^*;*她完全錯了^^*;*彼女は完全に間違っている^^*;*그녀는 완전히 틀렸다^^*;*वह पूरी तरह से गलत है ^^*;*هي مخطئة تماما ^^*;*সে পুরোপুরি ভুল ^^*;*Dia benar-benar salah ^^*;*เธอผิดทั้งหมด ^^*;*Cô ấy hoàn toàn sai ^^*
1;Althea;looksReal;Çok gerçekçi duruyor.;It looks so real!;¡Parece tan real!;Parece tão real!;Es sieht so echt aus!;Ça a l'air tellement réel!;Sembra così reale!;Wygląda tak realistycznie!;Это выглядит так реально!;看起来好真实！;看起來好真實！;すごくリアルに見える！;너무 진짜 같아 보여!;यह बहुत वास्तविक लगता है!;تبدو حقيقية جدا!;এটা খুব বাস্তব দেখাচ্ছে!;Terlihat sangat nyata!;ดูสมจริงมาก!;Trông thật là thật!
1;Althea;itIsReal;Bir saniye, bir şeyler hareket ediyor. Yoksa bu... gerçek mi?;Wait, something’s moving! Is it… real?;Espera, algo se está moviendo! ¿Es… real?;Espere, algo está se movendo! É… real?;Warte, etwas bewegt sich! Ist es… echt?;Attends, quelque chose bouge! C'est… réel?;Aspetta, qualcosa si sta muovendo! È… reale?;Czekaj, coś się porusza! Czy to… prawdziwe?;Подожди, что-то движется! Это… реально?;等等，有东西在动！它是……真的？;等等，有東西在動！它是……真的？;待って、何か動いている！これは…本物？;잠깐, 뭔가 움직이고 있어! 이건… 진짜야?;रुको, कुछ हिल रहा है! यह… असली है?;انتظر، شيء يتحرك! هل هو… حقيقي؟;অপেক্ষা করুন, কিছু নড়াচড়া করছে! এটা কি... আসল?;Tunggu, ada sesuatu yang bergerak! Apakah ini… nyata?;เดี๋ยวก่อน มีบางอย่างกำลังเคลื่อนไหว! มันคือ…ของจริงไหม?;Đợi đã, có cái gì đó đang di chuyển! Nó có… thật không?
1;Althea;wow;Vay be!;Wow!;¡Guau!;Uau!;Wow!;Waouh!;Wow!;Wow!;Вау!;哇！;哇！;わあ！;와우!;वाह!;واو!;ওয়াও!;Wow!;ว้าว!;Ồ!
;;jump;ZIPLA;JUMP;SALTA;PULAR;SPRINGEN;SAUTER;SALTARE;SKOCZ;ПРЫГАТЬ;跳;跳;ジャンプ;점프;कूदना;اقفز;লাফাও;Lompat;กระโดด;Nhảy
;;screaming;*Çığlık atıyor*;*Screaming*;*Gritando*;*Gritando*;*Schreiend*;*Criant*;*Urlando*;*Krzyczy*;*Кричит*;*尖叫*;*尖叫*;*叫ぶ*;*소리치다*;*चिल्लाते हुए*;*يصرخ*;*চিৎকার করছে*;*Berteriak*;*กรีดร้อง*;*La hét*
;;landed;*İniş yaptı*;*Landed*;*Aterrizó*;*Pousou*;*Gelandet*;*Atterri*;*Atterrato*;*Wylądował*;*Приземлился*;*着陆*;*著陸*;*着陸*;*착륙했다*;*उतर गया*;*هبط*;*অবতরণ করেছে*;*Mendarat*;*ลงจอด*;*Hạ cánh*
1;Althea;landedSoFast;Vay be! Çok hızlı düştüm ama acımadı bile.;Wow! I fell so fast, but it didn’t even hurt!;¡Guau! Caí tan rápido, pero ni siquiera me dolió!;Uau! Eu caí tão rápido, mas nem doeu!;Wow! Ich bin so schnell gefallen, aber es tat nicht einmal weh!;Waouh! Je suis tombé si vite, mais ça ne m'a même pas fait mal!;Wow! Sono caduto così in fretta, ma non mi ha nemmeno fatto male!;Wow! Upadłem tak szybko, ale nawet mnie nie bolało!;Вау! Я упал так быстро, но даже не почувствовал боли!;哇！我摔得那么快，但甚至没有受伤！;哇！我摔得那麼快，但甚至沒有受傷！;わあ！私はとても速く落ちましたが、痛くもありませんでした！;와우! 나는 너무 빨리 떨어졌지만 아프지도 않았다!;वाह! मैं इतनी जल्दी गिरा, लेकिन मुझे चोट भी नहीं लगी!;واو! سقطت بسرعة كبيرة، لكنني لم أشعر بأي ألم!;ওয়াও! আমি এত দ্রুত পড়েছিলাম, কিন্তু একটুও ব্যথা লাগেনি!;Wow! Saya jatuh begitu cepat, tapi itu bahkan tidak sakit!;ว้าว! ฉันล้มเร็วมาก แต่ก็ไม่เจ็บเลย!;Wow! Tôi đã ngã rất nhanh, nhưng thậm chí không đau!
1;Althea;whatIsThisPlace;*Etrafa bakarak* Burası neresi?;*Looking Around* What is this place?;*Mirando alrededor* ¿Qué es este lugar?;*Olhando ao redor* Que lugar é este?;*Umsehen* Was ist das für ein Ort?;*Regardant autour* Quel est cet endroit?;*Guardando intorno* Che posto è questo?;*Patrząc wokół* Co to za miejsce?;*Оглядываясь вокруг* Что это за место?;*环顾四周* 这是什么地方？;*環顧四周* 這是什麼地方？;*見渡す* ここは何ですか？;*둘러보며* 여기가 어디지?;*चारों ओर देखते हुए* यह स्थान क्या है?;*نظرت حولها* ما هذا المكان؟;*চারপাশে তাকিয়ে* এটি কোন জায়গা?;*Melihat sekeliling* Apa tempat ini?;*มองไปรอบ ๆ* นี่คือที่ไหน?;*Nhìn quanh* Đây là nơi nào?
1;Althea;snowyNotCold;Her tarafta kar var ama üşümüyorum. Neden acaba?;It's snowy but I'm not cold. I wonder why?;Está nevado, pero no tengo frío. Me pregunto por qué.;Está nevando, mas não estou com frio. Por quê será?;Es schneit, aber mir ist nicht kalt. Warum?;Il neige, mais je n'ai pas froid. Pourquoi?;Sta nevicando, ma non ho freddo. Perché?;Jest śnieżnie, ale nie jest mi zimno. Dlaczego?;Снежно, но мне не холодно. Почему?;下雪了，但我不冷。我想知道为什么？;下雪了，但我不冷。我想知道為什麼？;雪が降っているのに寒くない。なぜだろう？;눈이 오는데 춥지 않다. 왜지?;बर्फबारी हो रही है, लेकिन मुझे ठंड नहीं लग रही। ऐसा क्यों?;إنه يتساقط الثلج، لكني لست بارداً. لماذا؟;চারিদিকে তুষারপাত, কিন্তু আমার ঠান্ডা লাগছে না। কেন?;Ini bersalju tapi saya tidak kedinginan. Kenapa ya?;หิมะตก แต่ฉันไม่หนาวเลย ทำไมล่ะ?;Tuyết rơi nhưng tôi không thấy lạnh. Tại sao nhỉ?
1;Althea;hmmWhatShouldIDoNext;Hmmm acaba ne yapsam?;Hmm what should I do?;Hmm, ¿qué debería hacer?;Hmm, o que eu deveria fazer?;Hmm, was sollte ich tun?;Hmm, que dois-je faire?;Hmm, cosa dovrei fare?;Hmm, co powinienem zrobić?;Хм, что мне делать?;嗯，我该怎么办？;嗯，我該怎麼辦？;うーん、次は何をしようかな？;음, 뭘 해야 하지?;हम्म, मुझे क्या करना चाहिए?;هممم، ماذا يجب أن أفعل؟;হুম, আমি কি করব?;Hmm, apa yang harus saya lakukan?;ฮึม ฉันควรทำอะไรดี?;Hừm, tôi nên làm gì đây?
;;getInHouse;Eve gir.;Get in house.;Entrar en la casa.;Entrar na casa.;Ins Haus gehen.;Entrer dans la maison.;Entra in casa.;Wejdź do domu.;Зайти в дом.;进入房子。;進入房子。;家に入る。;집에 들어가다.;घर में प्रवेश करें।;ادخل المنزل.;বাড়িতে ঢোকো।;Masuk ke rumah.;เข้าบ้าน;Vào nhà.
;;examineSnowman;Kardan adamları incele.;Examine snowmen.;Examinar muñecos de nieve.;Examinar bonecos de neve.;Schneemänner untersuchen.;Examiner les bonshommes de neige.;Esamina i pupazzi di neve.;Zbadaj bałwany.;Осмотрите снеговиков.;检查雪人。;檢查雪人。;雪だるまを調べる。;눈사람을 조사하다.;स्नोमैन की जांच करें।;افحص رجال الثلج.;তুষারমানবদের পরীক্ষা করুন।;Periksa manusia salju.;ตรวจสอบตุ๊กตาหิมะ.;Kiểm tra người tuyết.
;;guestRoom;Misafir Odası;Guest Room;Habitación de invitados;Quarto de hóspedes;Gästezimmer;Chambre d'amis;Camera degli ospiti;Pokój gościnny;Гостевая комната;客房;客房;客室;손님 방;अतिथि कक्ष;غرفة الضيوف;অতিথি ঘর;Kamar tamu;ห้องพักแขก;Phòng khách.
;;kitchen;Mutfak;Kitchen;Cocina;Cozinha;Küche;Cuisine;Cucina;Kuchnia;Кухня;厨房;廚房;キッチン;부엌;रसोई;مطبخ;রান্নাঘর;Dapur;ห้องครัว;Nhà bếp.
;;unknownRoom;Bilinmeyen Oda;Unknown Room;Habitación desconocida;Quarto desconhecido;Unbekannter Raum;Pièce inconnue;Stanza sconosciuta;Nieznany pokój;Неизвестная комната;未知的房间;未知的房間;未知の部屋;알 수 없는 방;अज्ञात कक्ष;غرفة غير معروفة;অজানা ঘর;Ruang tak dikenal;ห้องที่ไม่รู้จัก;Phòng không xác định.
1;Althea;houseIsCompleted;Sanırım evi tamamen keşfettim. Burada yapacak bir şey kalmadı.;I think I've explored this house completely. Nothing left to do here.;Creo que he explorado completamente esta casa. No queda nada por hacer aquí.;Acho que explorei completamente esta casa. Nada mais a fazer aqui.;Ich glaube, ich habe dieses Haus komplett erkundet. Es gibt hier nichts mehr zu tun.;Je pense que j'ai complètement exploré cette maison. Il n'y a plus rien à faire ici.;Penso di aver esplorato completamente questa casa. Non c'è più niente da fare qui.;Myślę, że całkowicie zbadałem ten dom. Nie ma tu już nic do zrobienia.;Думаю, я полностью исследовал этот дом. Здесь больше нечего делать.;我想我已经完全探索了这所房子。这里没有什么可做的了。;我想我已經完全探索了這所房子。這裡沒有什麼可做的了。;家の探検を完全に終えたと思います。ここではもうやることはありません。;나는 이 집을 완전히 탐험한 것 같아. 여기에 할 일이 없다.;मुझे लगता है कि मैंने इस घर का पूरी तरह से अन्वेषण किया है। यहां करने के लिए कुछ नहीं बचा है।;أعتقد أنني استكشفت هذا المنزل بالكامل. لا يوجد شيء متبقي للقيام به هنا.;আমি মনে করি আমি সম্পূর্ণরূপে এই বাড়ির অনুসন্ধান করেছি। এখানে আর কিছু করার নেই।;Saya rasa saya telah menjelajahi rumah ini sepenuhnya. Tidak ada lagi yang perlu dilakukan di sini.;ฉันคิดว่าฉันได้สำรวจบ้านหลังนี้อย่างสมบูรณ์แล้ว ไม่มีอะไรเหลือให้ทำที่นี่;Tôi nghĩ tôi đã khám phá hết căn nhà này. Không còn gì để làm ở đây.
1;Althea;maybeIFindSomeone;Oh! Belki biriyle karşılaşırım!;Oh! Maybe I find someone!;¡Oh! ¡Tal vez encuentre a alguien!;Oh! Talvez eu encontre alguém!;Oh! Vielleicht finde ich jemanden!;Oh! Peut-être que je trouverai quelqu'un!;Oh! Forse trovo qualcuno!;Oh! Może znajdę kogoś!;О! Может быть, я кого-то найду!;哦！也许我会找到某人！;哦！也許我會找到某人！;ああ！誰か見つけるかも！;오! 누군가를 찾을지도 몰라!;ओह! शायद मुझे कोई मिल जाए!;أوه! ربما أجد شخصًا!;ওহ! হয়তো আমি কারো সাথে দেখা করব!;Oh! Mungkin saya menemukan seseorang!;โอ้! บางทีฉันอาจจะเจอใครบางคน!;Ồ! Có thể tôi sẽ tìm thấy ai đó!
;;knock;Tıkla;Knock;Llama;Bater;Klopfen;Frapper;Bussare;Pukać;Стучать;敲;敲;ノックする;두드리다;खटखटाओ;يطرق;ঠক ঠক;Ketuk;เคาะ;Gõ cửa.
;;ringTheBell;Zili çal;Ring the Bell;Toca el timbre;Toque a campainha;Klingeln;Sonnez la cloche;Suona il campanello;Zadzwoń dzwonkiem;Позвонить в звонок;按铃;按鈴;ベルを鳴らす;벨을 울리다;घंटी बजाओ;يرن الجرس;ঘণ্টা বাজান;Tekan bel;กดกริ่ง;Nhấn chuông.
;;tryOpenTheGate;Kapıyı açmaya çalış;Try Open the Gate;Intenta abrir la puerta;Tente abrir o portão;Versuchen, das Tor zu öffnen;Essayez d'ouvrir le portail;Prova ad aprire il cancello;Spróbuj otworzyć bramę;Попробовать открыть ворота;试图打开大门;試圖打開大門;門を開けようとする;문을 열려고 노력하다;दरवाजा खोलने की कोशिश करो;حاول فتح البوابة;দরজা খোলার চেষ্টা করো;Coba buka gerbang;ลองเปิดประตู;Cố gắng mở cổng.
;;punchTheDoor;Kapıya yumruk at;Punch the Door;Golpea la puerta;Dê um soco na porta;Schlag die Tür;Frappez la porte;Dai un pugno alla porta;Uderz w drzwi;Ударь в дверь;打门;打門;ドアを殴る;문을 치다;दरवाजे पर मुक्का मारें;اضرب الباب;দরজায় ঘুষি মারুন;Pukul pintu;ต่อยประตู;Đấm vào cửa.
1;Althea;hmmNothingHappens;Hmm. *duraksar* Hiçbir şey olmadı.;Hmm. *pauses* Nothing happened.;Hmm. *pausa* No pasó nada.;Hmm. *pausa* Nada aconteceu.;Hmm. *pause* Es ist nichts passiert.;Hmm. *pause* Il ne s'est rien passé.;Hmm. *pausa* Non è successo niente.;Hmm. *pauza* Nic się nie stało.;Хм. *пауза* Ничего не произошло.;嗯。*暂停* 什么都没发生。;嗯。*暫停* 什麼都沒發生。;うーん。*停止* 何も起こらなかった。;흠. *잠시 멈춤* 아무 일도 없었다.;हम्म। *ठहराव* कुछ नहीं हुआ।;هممم. *توقف* لم يحدث شيء.;হুম। *থেমে যায়* কিছুই ঘটেনি।;Hmm. *berhenti sejenak* Tidak ada yang terjadi.;ฮึม. *หยุด* ไม่มีอะไรเกิดขึ้น;Hừm. *tạm dừng* Không có gì xảy ra.
;;punch;Yumruk At;Punch;Golpea;Soque;Schlag;Frappez;Dai un pugno;Uderz;Ударь;打;打;パンチ;펀치;मुक्का मारना;لكمة;ঘুষি মারো;Pukul;ชก;Đấm.
1;Althea;haveIStrong;Hep bu kadar güçlü müydüm?;Have I always been this strong?;¿Siempre he sido tan fuerte?;Sempre fui tão forte assim?;War ich schon immer so stark?;Ai-je toujours été aussi fort?;Sono sempre stato così forte?;Czy zawsze byłem tak silny?;Я всегда был таким сильным?;我一直都这么强壮吗？;我一直都這麼強壯嗎？;私はいつもこんなに強かったの？;나는 항상 이렇게 강했나?;क्या मैं हमेशा इतना मजबूत था?;هل كنت دائمًا بهذه القوة؟;আমি কি সবসময় এত শক্তিশালী ছিলাম?;Apakah saya selalu sekuat ini?;ฉันเคยแข็งแกร่งขนาดนี้ไหม?;Tôi đã luôn mạnh mẽ như thế này sao?
