CHAR ID;CHAR NAMES;KEYS;Turkish;English;Spanish;Portuguese;German;French;Italian;Polish;Russian;ChineseSimplified;ChineseTraditional;Japanese;Korean;Indian;Arabic;Bengali;Indonesian;Thai;Vietnamese
1;Althea;whichDoorShouldIPick;Hangi kapıyı seçmeliyim?;Which door do I pick?;¿Qué puerta elijo?;Qual porta eu escolho?;Welche Tür soll ich nehmen?;Quelle porte devrais-je choisir?;Quale porta dovrei scegliere?;Które drzwi mam wybrać?;Какую дверь мне выбрать?;我应该选哪扇门？;我應該選哪扇門？;どのドアを選ぶべきですか？;어떤 문을 선택해야 할까?;मुझे कौन सा दरवाजा चुनना चाहिए?;أي باب يجب أن أختار؟;আমি কোন দরজা বেছে নেব?;Pintu mana yang harus saya pilih?;ฉันควรเลือกประตูไหน?;Tôi nên chọn cánh cửa nào?
;;altheaEntersHouse;*Eve girer*;*She enters the House*;*Entra en la casa*;*Ela entra na casa*;*Sie betritt das Haus*;*Elle entre dans la maison*;*Entra nella casa*;*Wchodzi do domu*;*Она входит в дом*;*她进了房子*;*她進了房子*;*彼女は家に入る*;*그녀는 집에 들어간다*;*वह घर में प्रवेश करती है*;*تدخل المنزل*;*সে বাড়িতে প্রবেশ করে*;*Dia memasuki rumah*;*เธอเข้าไปในบ้าน*;*Cô ấy bước vào nhà*
1;Althea;whatAnAmazingPlace;Ne kadar muhteşem bir yer!;What an amazing place!;¡Qué lugar tan asombroso!;Que lugar incrível!;Was für ein erstaunlicher Ort!;Quel endroit incroyable!;Che posto incredibile!;Co za niesamowite miejsce!;Какое удивительное место!;多么神奇的地方啊！;多麼神奇的地方啊！;なんて素晴らしい場所だ！;정말 멋진 곳이야!;क्या ही अद्भुत स्थान है!;يا له من مكان رائع!;কি অসাধারণ জায়গা!;Tempat yang luar biasa!;ช่างเป็นสถานที่ที่น่าอัศจรรย์!;Thật là một nơi tuyệt vời!
1;Althea;filledWithPresents;Burası hediyelerle dolu! Acaba bu evde kaç çocuk yaşıyordu?;The place is filled with presents. I wonder how many children lived here?;El lugar está lleno de regalos. Me pregunto cuántos niños vivieron aquí.;O lugar está cheio de presentes. Eu me pergunto quantas crianças viviam aqui?;Der Ort ist voller Geschenke. Ich frage mich, wie viele Kinder hier gelebt haben?;L'endroit est rempli de cadeaux. Je me demande combien d'enfants vivaient ici?;Il posto è pieno di regali. Mi chiedo quanti bambini vivevano qui?;Miejsce jest pełne prezentów. Zastanawiam się, ile dzieci tutaj mieszkało?;Место заполнено подарками. Интересно, сколько детей здесь жило?;这里到处都是礼物。我想知道这里住了多少孩子？;這裡到處都是禮物。我想知道這裡住了多少孩子？;この場所はプレゼントでいっぱいです。ここには何人の子供が住んでいたのでしょうか？;여기는 선물로 가득 차 있어. 여기에 몇 명의 아이들이 살았을까?;यह जगह उपहारों से भरी हुई है। मुझे आश्चर्य है कि यहाँ कितने बच्चे रहते थे?;المكان مليء بالهدايا. أتساءل كم عدد الأطفال الذين عاشوا هنا؟;এখানে উপহার দিয়ে ভরা। এখানে কত শিশু থাকতো?;Tempat ini penuh dengan hadiah. Saya bertanya-tanya berapa banyak anak yang tinggal di sini?;ที่นี่เต็มไปด้วยของขวัญ ฉันสงสัยว่ามีเด็กอยู่ที่นี่กี่คน?;Nơi này đầy quà tặng. Tôi tự hỏi có bao nhiêu đứa trẻ đã sống ở đây?
1;Althea;isThisMirrorAPresent;Bu ayna da bir hediye mı?;Is this mirror also a present?;¿Este espejo también es un regalo?;Este espelho também é um presente?;Ist dieser Spiegel auch ein Geschenk?;Ce miroir est-il aussi un cadeau?;Anche questo specchio è un regalo?;Czy to lustro też jest prezentem?;Это зеркало тоже подарок?;这面镜子也是礼物吗？;這面鏡子也是禮物嗎？;この鏡もプレゼントなの？;이 거울도 선물인가요?;क्या यह दर्पण भी एक उपहार है?;هل هذه المرآة أيضًا هدية؟;এই আয়নাটিও কি একটি উপহার?;Apakah cermin ini juga hadiah?;กระจกนี้ก็เป็นของขวัญด้วยหรือเปล่า?;Chiếc gương này cũng là một món quà sao?
1;Althea;whoIsThisMonster;Bu canavar da kim?;Who is this monster?;¿Quién es este monstruo?;Quem é esse monstro?;Wer ist dieses Monster?;Qui est ce monstre?;Chi è questo mostro?;Kim jest tym potworem?;Кто это монстр?;这个怪物是谁？;這個怪物是誰？;このモンスターは誰？;이 괴물은 누구지?;यह राक्षस कौन है?;من هو هذا الوحش؟;এই দৈত্য কে?;Siapa monster ini?;สัตว์ประหลาดนี้คือใคร?;Con quái vật này là ai?
1;Althea;amIAMonster;*Korkar* Ben bir canavar mıyım?;*Scared* Am I a monster?;*Asustado* ¿Soy un monstruo?;*Assustado* Eu sou um monstro?;*Erschrocken* Bin ich ein Monster?;*Effrayé* Suis-je un monstre?;*Spaventato* Sono un mostro?;*Przestraszony* Czy jestem potworem?;*Напуганный* Я монстр?;*害怕* 我是怪物吗？;*害怕* 我是怪物嗎？;*怖がる* 私はモンスターですか？;*겁에 질려* 내가 괴물이야?;*डरते हुए* क्या मैं एक राक्षस हूँ?;*خائف* هل أنا وحش؟;*ভীত* আমি কি একটি দৈত্য?;*Takut* Apakah saya monster?;*ตกใจ* ฉันเป็นสัตว์ประหลาดหรือเปล่า?;*Sợ hãi* Tôi có phải là quái vật không?
1;Althea;ofCourseImNotAMonster;Tabii ki canavar değilim! Ne düşünüyordum ki?;Of course I am not a monster! What was I thinking?;¡Por supuesto que no soy un monstruo! ¿En qué estaba pensando?;Claro que não sou um monstro! O que eu estava pensando?;Natürlich bin ich kein Monster! Was habe ich mir dabei gedacht?;Bien sûr, je ne suis pas un monstre! À quoi pensais-je?;Ovviamente non sono un mostro! A cosa stavo pensando?;Oczywiście, że nie jestem potworem! Co ja sobie myślałem?;Конечно, я не монстр! О чем я думал?;当然我不是怪物！我在想什么？;當然我不是怪物！我在想什麼？;もちろん私はモンスターではありません！私は何を考えていたのでしょう？;물론 나는 괴물이 아니야! 내가 무슨 생각을 했을까?;बिल्कुल, मैं एक राक्षस नहीं हूँ! मैं क्या सोच रहा था?;بالطبع أنا لست وحشًا! ماذا كنت أفكر؟;অবশ্যই আমি দৈত্য নই! আমি কী ভাবছিলাম?;Tentu saja saya bukan monster! Apa yang saya pikirkan?;แน่นอนว่าฉันไม่ใช่สัตว์ประหลาด! ฉันกำลังคิดอะไรอยู่?;Tất nhiên tôi không phải là quái vật! Tôi đang nghĩ gì vậy?
1;Althea;magicalPlaceIsReason;Bu büyülü yer yüzünden ayna beni farklı göstermiş olmalı.;This magical place must be the reason for it.;Este lugar mágico debe ser la razón.;Este lugar mágico deve ser a razão.;Dieser magische Ort muss der Grund dafür sein.;Cet endroit magique doit en être la raison.;Questo luogo magico deve essere la causa.;To magiczne miejsce musi być powodem.;Это магическое место должно быть причиной.;这个神奇的地方一定是原因。;這個神奇的地方一定是原因。;この魔法の場所が理由に違いない。;이 마법의 장소가 이유일 것이다.;यह जादुई जगह इसका कारण होनी चाहिए।;هذا المكان السحري يجب أن يكون السبب.;এই যাদুকরী জায়গা এর কারণ হতে পারে।;Tempat ajaib ini pasti alasannya.;สถานที่วิเศษนี้ต้องเป็นเหตุผลแน่ๆ;Nơi huyền diệu này chắc hẳn là lý do.
1;Althea;nothingLeftInThisRoom;Neyse, sanırım bu odada yapacak bir şey kalmadı.;Anyway, I guess there’s nothing left to do in this room.;De todos modos, supongo que no queda nada por hacer en esta habitación.;Enfim, acho que não há mais nada para fazer nesta sala.;Wie auch immer, ich glaube, es gibt nichts mehr in diesem Raum zu tun.;De toute façon, je suppose qu'il n'y a plus rien à faire dans cette pièce.;Comunque, credo che non ci sia più niente da fare in questa stanza.;Tak czy inaczej, chyba nie ma już nic do zrobienia w tym pokoju.;В любом случае, думаю, в этой комнате больше нечего делать.;反正我猜这房间里没什么可做的了。;反正我猜這房間裡沒什麼可做的了。;とにかく、この部屋でやることはもうないと思います。;어쨌든, 이 방에서 할 일이 남아 있지 않은 것 같아.;वैसे भी, मुझे लगता है कि इस कमरे में अब कुछ भी करने के लिए नहीं बचा है।;على أي حال، أعتقد أنه لم يعد هناك شيء يمكن القيام به في هذه الغرفة.;যাই হোক, আমি মনে করি এই ঘরে করার মতো আর কিছু নেই।;Bagaimanapun, saya rasa tidak ada lagi yang perlu dilakukan di ruangan ini.;อย่างไรก็ตาม ฉันคิดว่าไม่มีอะไรให้ทำในห้องนี้แล้ว;Dù sao, tôi đoán không còn gì để làm trong căn phòng này.
1;Althea;backToTheHallway;Koridora dönsem iyi olacak.;I’d better head back to the hallway.;Será mejor que regrese al pasillo.;É melhor eu voltar para o corredor.;Ich sollte besser zurück in den Flur gehen.;Je ferais mieux de retourner dans le couloir.;Meglio che torni nel corridoio.;Lepiej, żebym wrócił do korytarza.;Лучше вернусь в коридор.;我最好回到走廊。;我最好回到走廊。;廊下に戻ったほうがいい。;복도로 돌아가는 게 좋겠다.;मुझे बेहतर होगा कि मैं गलियारे में वापस जाऊं।;من الأفضل أن أعود إلى الرواق.;আমার করিডরে ফিরে যাওয়া উচিত।;Sebaiknya saya kembali ke lorong.;ฉันควรกลับไปที่ทางเดิน;Tốt hơn tôi nên quay lại hành lang.
1;Althea;kitchenSoClean;Mutfak saçma düzeyde temiz!;This kitchen is ridiculously clean!;¡Esta cocina está ridículamente limpia!;Esta cozinha está ridiculamente limpa!;Diese Küche ist unglaublich sauber!;Cette cuisine est ridiculement propre!;Questa cucina è ridicolmente pulita!;Ta kuchnia jest absurdalnie czysta!;Эта кухня нелепо чиста!;这间厨房干净得离谱！;這間廚房乾淨得離譜！;このキッチンは信じられないほどきれいです！;이 부엌은 너무나도 깨끗하다!;यह रसोई अत्यधिक साफ है!;هذه المطبخ نظيف بشكل يثير السخرية!;এই রান্নাঘর অযৌক্তিকভাবে পরিষ্কার!;Dapur ini sangat bersih!;ห้องครัวนี้สะอาดจนเกินไป!;Nhà bếp này sạch sẽ đến mức lố bịch!
1;Althea;aLotOfFood;Şu yemeklere bak! Hepsi de çok taze.;Look at all this food! And it's all so fresh!;¡Mira toda esta comida! ¡Y está toda tan fresca!;Olhe para toda esta comida! E está tudo tão fresco!;Schau dir das ganze Essen an! Und es ist alles so frisch!;Regardez toute cette nourriture ! Et elle est toute si fraîche !;Guarda tutto questo cibo! Ed è tutto così fresco!;Spójrz na całe to jedzenie! I wszystko jest takie świeże!;Посмотрите на всю эту еду! И всё такое свежее!;看看这些食物！而且全都很新鲜！;看看這些食物！而且全都很新鮮！;この食べ物を見てください！そしてすべてがとても新鮮です！;이 음식을 봐! 전부 너무 신선하다!;इस सारे भोजन को देखो! और यह सब बहुत ताजा है!;انظر إلى كل هذا الطعام! وكلها طازجة جدًا!;এই সমস্ত খাবারের দিকে তাকান! এবং সবকিছুই খুব তাজা!;Lihat semua makanan ini! Dan semuanya sangat segar!;ดูอาหารทั้งหมดนี้สิ! และมันสดใหม่มาก!;Nhìn tất cả thức ăn này! Và tất cả đều rất tươi!
1;Althea;somethingWrongFood;Ama bir gariplik var. Yemekler çok taze ve mükemmel görünüyorlar ama soğuklar. Ne kadar zamandır burada bekliyorlardı?;But something's off. Everything looks so fresh and perfect, yet it's all cold. How long have these meals been here?;Pero algo está mal. Todo se ve tan fresco y perfecto, pero está todo frío. ¿Cuánto tiempo han estado aquí estas comidas?;Mas tem algo errado. Tudo parece tão fresco e perfeito, mas está tudo frio. Quanto tempo essas refeições estiveram aqui?;Aber etwas stimmt nicht. Alles sieht so frisch und perfekt aus, aber es ist alles kalt. Wie lange liegen diese Mahlzeiten schon hier?;Mais quelque chose ne va pas. Tout semble si frais et parfait, mais tout est froid. Depuis combien de temps ces repas sont-ils là ?;Ma c'è qualcosa che non va. Tutto sembra così fresco e perfetto, ma è tutto freddo. Da quanto tempo sono qui questi pasti?;Ale coś jest nie tak. Wszystko wygląda na takie świeże i doskonałe, a jednak jest zimne. Jak długo te posiłki tu są?;Но что-то не так. Всё выглядит таким свежим и идеальным, но всё холодное. Сколько времени эти блюда здесь лежат?;但有些不对劲。一切看起来都很新鲜完美，但全都冷了。这些食物在这里放了多久了？;但有些不對勁。一切看起來都很新鮮完美，但全都冷了。這些食物在這裡放了多久了？;しかし、何かがおかしい。すべてがとても新鮮で完璧に見えますが、すべて冷たいです。これらの食事はどれくらいここにありますか？;하지만 뭔가 이상해. 모든 게 너무 신선하고 완벽해 보이지만, 다 차가워. 이 음식들이 얼마나 오래 여기 있었을까?;लेकिन कुछ गड़बड़ है। सब कुछ इतना ताजा और परिपूर्ण दिखता है, फिर भी सब कुछ ठंडा है। ये भोजन यहाँ कितने समय से हैं?;لكن هناك شيء ما غير صحيح. كل شيء يبدو طازجًا ومثاليًا، لكنه بارد. كم من الوقت كانت هذه الوجبات هنا؟;কিন্তু কিছু একটা ভুল। সবকিছু এত তাজা এবং নিখুঁত দেখাচ্ছে, কিন্তু সব ঠান্ডা। এই খাবারগুলি এখানে কতদিন ধরে রয়েছে?;Tapi ada yang salah. Semuanya terlihat begitu segar dan sempurna, tetapi semuanya dingin. Sudah berapa lama makanan ini ada di sini?;แต่มันแปลกๆ ทุกอย่างดูสดใหม่และสมบูรณ์แบบ แต่เย็นชืด อาหารเหล่านี้อยู่ที่นี่นานแค่ไหนแล้ว?;Nhưng có gì đó không ổn. Mọi thứ trông thật tươi mới và hoàn hảo, nhưng tất cả đều lạnh. Những bữa ăn này đã ở đây bao lâu rồi?
1;Althea;nothingToDoKitchen;Neyse, mutfakta yapacak bir şey kalmadı sanırım.;Anyway, there’s not much to do in the kitchen, I guess.;De todos modos, supongo que no hay mucho que hacer en la cocina.;De qualquer forma, não há muito o que fazer na cozinha, eu acho.;Wie auch immer, ich denke, es gibt nicht viel zu tun in der Küche.;De toute façon, je suppose qu'il n'y a pas grand-chose à faire dans la cuisine.;Comunque, non c'è molto da fare in cucina, immagino.;Tak czy inaczej, nie ma zbyt wiele do zrobienia w kuchni, jak sądzę.;В любом случае, думаю, что в кухне делать особо нечего.;反正我想在厨房里没什么可做的。;反正我想在廚房裡沒什麼可做的。;とにかく、キッチンではあまりやることはないと思います。;어쨌든, 부엌에서 할 일이 많지 않은 것 같아.;वैसे भी, मुझे लगता है कि रसोई में ज्यादा कुछ करने के लिए नहीं बचा है।;على أي حال، أعتقد أنه ليس هناك الكثير للقيام به في المطبخ.;যাই হোক, রান্নাঘরে করার মতো কিছুই নেই, আমার মনে হয়।;Bagaimanapun, sepertinya tidak banyak yang bisa dilakukan di dapur.;อย่างไรก็ตาม ฉันคิดว่าไม่มีอะไรให้ทำในครัวแล้ว;Dù sao, tôi đoán không còn gì để làm trong bếp.
1;Althea;expRoom_SomethingBad;Burada kötü bir şeyler olmuş sanırım.;I think something bad happened here.;Creo que algo malo sucedió aquí.;Acho que algo ruim aconteceu aqui.;Ich denke, hier ist etwas Schlimmes passiert.;Je pense que quelque chose de mal s'est passé ici.;Penso che qualcosa di brutto sia successo qui.;Myślę, że coś złego się tutaj stało.;Думаю, здесь произошло что-то плохое.;我觉得这里发生了不好的事情。;我覺得這裡發生了不好的事情。;ここで何か悪いことが起きたと思います。;여기서 나쁜 일이 있었던 것 같아.;मुझे लगता है कि यहां कुछ बुरा हुआ है।;أعتقد أن شيئًا سيئًا قد حدث هنا.;আমার মনে হয় এখানে কিছু খারাপ কিছু হয়েছে।;Saya pikir sesuatu yang buruk terjadi di sini.;ฉันคิดว่ามีบางอย่างที่ไม่ดีเกิดขึ้นที่นี่;Tôi nghĩ rằng đã xảy ra chuyện gì đó xấu ở đây.
1;Althea;expRoom_WhatFeeling;Bu his ne böyle? Heyecan mı?;What is this feeling, excitement?;¿Qué es este sentimiento, emoción?;Qual é esse sentimento, empolgação?;Was ist das für ein Gefühl, Aufregung?;Quel est ce sentiment, excitation?;Che cos'è questa sensazione, eccitazione?;Co to za uczucie, podekscytowanie?;Что это за чувство, волнение?;这是什么感觉，兴奋？;這是什麼感覺，興奮？;この感情は何ですか、興奮ですか？;이 기분은 뭐지, 흥분인가?;यह भावना क्या है, उत्साह?;ما هذا الشعور، الحماس؟;এই অনুভূতি কি, উত্তেজনা?;Apa ini, perasaan senang?;นี่คือความรู้สึกอะไร ตื่นเต้นเหรอ?;Cảm giác này là gì, phấn khích sao?
1;Althea;expRoom_ItsNotExciting;Hayır, bu heyecan değil. Kendimi… kötü hissediyorum.;No, it’s not excitement. I feel… bad.;No, no es emoción. Me siento... mal.;Não, não é empolgação. Eu me sinto... mal.;Nein, es ist keine Aufregung. Ich fühle mich... schlecht.;Non, ce n'est pas de l'excitation. Je me sens... mal.;No, non è eccitazione. Mi sento... male.;Nie, to nie jest ekscytacja. Czuję się... źle.;Нет, это не возбуждение. Мне... плохо.;不，这不是兴奋。我感觉……不好。;不，這不是興奮。我感覺……不好。;いいえ、これは興奮ではありません。私は…気分が悪い。;아니야, 이건 흥분이 아니야. 기분이... 안 좋아.;नहीं, यह उत्साह नहीं है। मैं... बुरा महसूस कर रहा हूँ।;لا، هذا ليس حماسًا. أشعر... بالسوء.;না, এটি উত্তেজনা নয়। আমি... খারাপ বোধ করছি।;Tidak, ini bukan kegembiraan. Saya merasa... buruk.;ไม่ นี่ไม่ใช่ความตื่นเต้น ฉันรู้สึก... แย่;Không, không phải sự phấn khích. Tôi cảm thấy... tệ.
1;Althea;expRoom_IsItFear;Bekle biraz, bu his… korku olabilir mi?;Wait, could this feeling be… fear?;Espera, ¿podría ser este sentimiento... miedo?;Espere, esse sentimento poderia ser... medo?;Warte, könnte dieses Gefühl... Angst sein?;Attends, ce sentiment pourrait-il être... de la peur?;Aspetta, questa sensazione potrebbe essere... paura?;Czekaj, czy to uczucie może być... strach?;Подожди, это чувство может быть... страхом?;等等，这种感觉可能是……恐惧？;等等，這種感覺可能是……恐懼？;待って、この感覚は...恐怖かもしれない？;잠깐, 이 감정이... 두려움일까?;रुको, क्या यह भावना... डर हो सकती है?;انتظر، هل يمكن أن يكون هذا الشعور... خوفًا؟;অপেক্ষা করুন, এই অনুভূতিটি কি... ভয় হতে পারে?;Tunggu, apakah perasaan ini... ketakutan?;เดี๋ยวก่อน ความรู้สึกนี้อาจเป็น... ความกลัว?;Chờ đã, cảm giác này có thể là... sợ hãi không?
1;Althea;expRoom_NeedToGetOut;Buradan çıkmam lazım, HEMEN!;I need to get out of here, NOW!;¡Necesito salir de aquí, AHORA!;Eu preciso sair daqui, AGORA!;Ich muss hier raus, JETZT!;Je dois sortir d'ici, MAINTENANT!;Devo uscire di qui, ORA!;Muszę się stąd wydostać, TERAZ!;Мне нужно выйти отсюда, СЕЙЧАС!;我得马上离开这里！;我得馬上離開這裡！;私はここからすぐに出なければなりません！;지금 당장 여기서 나가야 해!;मुझे यहाँ से अभी निकलना होगा!;يجب أن أخرج من هنا، الآن!;আমাকে এখান থেকে এখনই বের হতে হবে!;Saya harus keluar dari sini, SEKARANG!;ฉันต้องออกจากที่นี่ เดี๋ยวนี้!;Tôi cần ra khỏi đây, NGAY LẬP TỨC!
;;expRoom_SubjectIsEscaping;TEHLİKE! Deney #0003 (Kod Adı: ALTHEA) kaçmaya çalışıyor!;DANGER! Experiment #0003 (Code Name: ALTHEA) is attempting to escape!;¡PELIGRO! ¡El Experimento #0003 (Nombre en clave: ALTHEA) está intentando escapar!;PERIGO! O Experimento #0003 (Nome de Código: ALTHEA) está tentando escapar!;GEFAHR! Experiment #0003 (Deckname: ALTHEA) versucht zu entkommen!;DANGER! Expérience #0003 (Nom de Code: ALTHEA) tente de s'échapper!;PERICOLO! L'Esperimento #0003 (Nome in Codice: ALTHEA) sta tentando di scappare!;NIEBEZPIECZEŃSTWO! Eksperyment #0003 (Nazwa kodowa: ALTHEA) próbuje uciec!;ОПАСНОСТЬ! Эксперимент #0003 (Кодовое имя: ALTHEA) пытается сбежать!;危险！实验#0003（代号：ALTHEA）试图逃跑！;危險！實驗#0003（代號：ALTHEA）試圖逃跑！;危険！実験#0003（コードネーム：ALTHEA）が脱出を試みています！;위험! 실험 #0003 (코드명: ALTHEA)이 탈출을 시도하고 있습니다!;खतरा! प्रयोग #0003 (कोड नाम: ALTHEA) भागने की कोशिश कर रहा है!;خطر! التجربة #0003 (الاسم الرمزي: ALTHEA) تحاول الهروب!;বিপদ! পরীক্ষা #০০০৩ (কোড নাম: ALTHEA) পালানোর চেষ্টা করছে!;BAHAYA! Eksperimen #0003 (Nama Kode: ALTHEA) mencoba melarikan diri!;อันตราย! การทดลอง #0003 (ชื่อรหัส: ALTHEA) กำลังพยายามหลบหนี!;NGUY HIỂM! Thí nghiệm #0003 (Tên mã: ALTHEA) đang cố gắng trốn thoát!
