CHAR ID;CHAR NAMES;KEYS;Turkish;English;Spanish;Portuguese;German;French;Italian;Polish;Russian;ChineseSimplified;ChineseTraditional;Japanese;Korean;Indian;Arabic;Bengali;Indonesian;Thai;Vietnamese
1;Althea;althItsNotHurting;Bekle biraz. Yanıyorum, ama hiç acımıyor. Çok ilginç;Wait a second. I’m on fire, but it doesn’t hurt at all. How interesting.;Espera un momento. Estoy en llamas, pero no duele en absoluto. Qué interesante.;Espere um segundo. Estou em chamas, mas não dói nada. Que interessante.;Warte eine Sekunde. Ich brenne, aber es tut überhaupt nicht weh. Wie interessant.;Attends une seconde. Je suis en feu, mais ça ne fait pas du tout mal. Comme c'est intéressant.;Aspetta un secondo. Sto bruciando, ma non fa per niente male. Che interessante.;Poczekaj chwilę. Płonę, ale wcale nie boli. Jakie to interesujące.;Подожди секунду. Я горю, но это совсем не больно. Как интересно.;等一下。我着火了，但一点也不痛。真有趣。;等一下。我著火了，但一點也不痛。真有趣。;ちょっと待って。私は燃えていますが、全く痛くありません。とても興味深い。;잠깐. 나는 불타고 있지만 전혀 아프지 않아. 정말 흥미롭다.;एक सेकंड रुको। मैं जल रहा हूँ, लेकिन बिल्कुल भी दर्द नहीं हो रहा है। कितना दिलचस्प।;انتظر لحظة. أنا مشتعلة، ولكنها لا تؤلمني على الإطلاق. مثير للاهتمام جدا.;একটু অপেক্ষা করুন। আমি জ্বলছি, কিন্তু একেবারেই ব্যথা লাগছে না। কতটা আকর্ষণীয়।;Tunggu sebentar. Aku terbakar, tetapi sama sekali tidak sakit. Betapa menariknya.;เดี๋ยวก่อน ฉันไฟลุกท่วม แต่ไม่เจ็บเลย น่าสนใจมาก;Chờ chút. Tôi đang bốc cháy, nhưng không đau chút nào. Thật thú vị.
;;narrativeExtinguish;*Alevler çok kısa sürede söner.*;*The flames extinguish shortly after.*;*Las llamas se apagan poco después.*;*As chamas se extinguem logo depois.*;*Die Flammen erlöschen kurz darauf.*;*Les flammes s'éteignent peu après.*;*Le fiamme si spengono poco dopo.*;*Płomienie gasną niedługo potem.*;*Пламя гаснет вскоре после этого.*;*火焰很快熄灭。*;*火焰很快熄滅。*;*炎はその後すぐに消えます。*;*불꽃은 곧 꺼진다.*;*आग की लपटें थोड़ी देर बाद बुझ जाती हैं।*;*اللهب ينطفئ بعد ذلك بوقت قصير.*;*আগুনের শিখা অল্প সময়ের মধ্যে নেভে।*;*Api padam tak lama setelahnya.*;*เปลวไฟดับในไม่ช้า*;*Ngọn lửa tắt ngay sau đó.*
1;Althea;althNoNeedToScare;Alevler hiç canımı yakmadı ve cabucak söndü. Sanırım korkmama gerek yoktu.;The fire didn’t hurt at all and went out quickly. I guess there was no need to be so scared.;El fuego no me lastimó en absoluto y se apagó rápidamente. Supongo que no había necesidad de tener tanto miedo.;O fogo não me machucou nem um pouco e apagou rapidamente. Acho que não havia necessidade de ter tanto medo.;Das Feuer tat überhaupt nicht weh und ging schnell aus. Ich denke, es war nicht nötig, so viel Angst zu haben.;Le feu ne m'a pas du tout fait mal et s'est rapidement éteint. Je suppose qu'il n'y avait pas besoin d'avoir si peur.;Il fuoco non mi ha fatto affatto male e si è spento rapidamente. Immagino non ci fosse bisogno di essere così spaventati.;Ogień wcale mnie nie skrzywdził i szybko zgasł. Myślę, że nie było potrzeby tak bardzo się bać.;Огонь совсем не обжёг и быстро погас. Думаю, не стоило так бояться.;火焰一点都不疼，很快就熄灭了。我想没必要这么害怕。;火焰一點都不疼，很快就熄滅了。我想沒必要這麼害怕。;火は全く痛くなく、すぐに消えました。そんなに怖がる必要はなかったと思います。;불꽃은 전혀 아프지 않았고 곧 꺼졌다. 그렇게 겁낼 필요가 없었나 봐.;आग ने बिल्कुल भी चोट नहीं पहुंचाई और जल्दी बुझ गई। मुझे लगता है कि इतना डरने की जरूरत नहीं थी।;النار لم تؤذيني على الإطلاق وانطفأت بسرعة. أعتقد أنه لم تكن هناك حاجة للخوف كثيرًا.;আগুন আমাকে একেবারেই আঘাত করেনি এবং দ্রুত নেভে। আমার মনে হয় এত ভয় পাওয়ার দরকার ছিল না।;Api sama sekali tidak melukai saya dan padam dengan cepat. Saya rasa tidak perlu begitu takut.;ไฟไม่เจ็บเลย และก็ดับไปอย่างรวดเร็ว ฉันคิดว่าไม่จำเป็นต้องกลัวขนาดนั้น;Lửa không làm tôi đau và đã tắt nhanh chóng. Tôi nghĩ không cần phải sợ đến vậy.
1;Althea;althStrangeMagicalPlace;Bu büyülü yer beni hem koruyor hem de zarar vermeye çalışıyor. Ne kadar garip.;This magical place is both protecting me and trying to harm me. So strange.;Este lugar mágico tanto me protege como intenta dañarme. Qué extraño.;Este lugar mágico está tanto me protegendo quanto tentando me machucar. Que estranho.;Dieser magische Ort schützt mich und versucht gleichzeitig, mir zu schaden. Wie seltsam.;Cet endroit magique me protège et essaie de me faire du mal. Si étrange.;Questo luogo magico mi protegge e allo stesso tempo cerca di farmi del male. Così strano.;To magiczne miejsce mnie chroni i jednocześnie próbuje mnie skrzywdzić. Jakie to dziwne.;Это волшебное место и защищает меня, и пытается навредить. Как странно.;这个神奇的地方既保护我又试图伤害我。真奇怪。;這個神奇的地方既保護我又試圖傷害我。真奇怪。;この魔法の場所は私を守りながら、害を与えようとしています。とても奇妙です。;이 마법의 장소는 나를 보호하면서도 해치려고 한다. 정말 이상하다.;यह जादुई जगह मुझे बचाने और मुझे चोट पहुंचाने की कोशिश कर रही है। कितना अजीब।;هذا المكان السحري يحميني ويحاول أن يؤذيني. غريب جدا.;এই জাদুকরী জায়গাটি আমাকে রক্ষা করছে এবং আমাকে আঘাত করার চেষ্টা করছে। কত অদ্ভুত।;Tempat ajaib ini melindungi saya dan mencoba menyakiti saya. Sangat aneh.;สถานที่วิเศษนี้ทั้งปกป้องฉันและพยายามทำร้ายฉัน แปลกจริงๆ;Nơi huyền diệu này vừa bảo vệ tôi vừa cố làm hại tôi. Thật kỳ lạ.
1;Althea;althNotToMessOthers;Neyse, diğer kardan adamlara bulaşmamak en iyisi.;Anyway, it’s best not to mess with the other snowmen.;De todos modos, es mejor no meterse con los otros muñecos de nieve.;De qualquer forma, é melhor não mexer com os outros bonecos de neve.;Wie auch immer, es ist besser, sich nicht mit den anderen Schneemännern anzulegen.;De toute façon, il vaut mieux ne pas embêter les autres bonshommes de neige.;Comunque, è meglio non mettersi nei guai con gli altri pupazzi di neve.;Tak czy inaczej, najlepiej nie zadzierać z innymi bałwanami.;В любом случае, лучше не связываться с другими снеговиками.;无论如何，最好不要惹其他雪人。;無論如何，最好不要惹其他雪人。;とにかく、他の雪だるまとは関わらない方がいい。;어쨌든, 다른 눈사람들과 엮이지 않는 게 좋다.;वैसे भी, अन्य स्नोमैन के साथ खिलवाड़ न करना सबसे अच्छा है।;على أي حال، من الأفضل عدم العبث مع رجال الثلج الآخرين.;যাই হোক, অন্যান্য তুষারমানবদের সঙ্গে বিরক্ত না করাই ভালো।;Bagaimanapun, lebih baik tidak mengganggu manusia salju lainnya.;อย่างไรก็ตาม ดีกว่าที่จะไม่ยุ่งกับตุ๊กตาหิมะตัวอื่น ๆ;Dù sao, tốt nhất là không dây vào những người tuyết khác.
1;Althea;betterCheckTheHouse;Evi de kontrol etsem iyi olacak.;I should check the house too.;Debería revisar la casa también.;Eu deveria verificar a casa também.;Ich sollte auch das Haus überprüfen.;Je devrais vérifier la maison aussi.;Dovrei controllare anche la casa.;Powinienem również sprawdzić dom.;Мне следует тоже проверить дом.;我也应该检查一下房子。;我也應該檢查一下房子。;家も確認したほうがいいですね。;집도 확인해야겠어.;मुझे घर भी जांचना चाहिए।;يجب أن أتحقق من المنزل أيضًا.;আমার বাড়িটিও পরীক্ষা করা উচিত।;Saya juga harus memeriksa rumah.;ฉันควรตรวจสอบบ้านด้วย;Tôi cũng nên kiểm tra căn nhà.
1;Althea;betterCheckTheSnowmans;Kardan adamlara da baksam iyi olacak. Çok tatlılardı!;I should check the snowmans too. They were cute!;También debería revisar a los muñecos de nieve. ¡Eran adorables!;Eu deveria verificar os bonecos de neve também. Eles eram fofos!;Ich sollte mir auch die Schneemänner ansehen. Sie waren süß!;Je devrais aussi vérifier les bonshommes de neige. Ils étaient mignons!;Dovrei controllare anche i pupazzi di neve. Erano carini!;Powinienem również sprawdzić bałwany. Były urocze!;Мне стоит тоже посмотреть на снеговиков. Они были милыми!;我也应该检查一下雪人。他们很可爱！;我也應該檢查一下雪人。他們很可愛！;雪だるまも確認したほうがいいですね。とても可愛かったです！;눈사람도 확인해야겠어. 정말 귀여웠어!;मुझे स्नोमैन को भी देखना चाहिए। वे बहुत प्यारे थे!;يجب أن أتحقق من رجال الثلج أيضًا. كانوا لطفاء!;আমার তুষারমানবদের দিকেও তাকানো উচিত। তারা খুব সুন্দর ছিল!;Saya juga harus memeriksa manusia salju. Mereka lucu!;ฉันควรตรวจสอบตุ๊กตาหิมะด้วย พวกเขาน่ารักมาก!;Tôi cũng nên kiểm tra những người tuyết. Họ thật dễ thương!
1;Althea;hmmmItsLocked;Hmmm. *duraksar* kapı kilitli.;Hmm. *pauses* It's locked.;Hmmm. *Hace una pausa* Está cerrado con llave.;Hmmm. *Pausa* Está trancada.;Hmmm. *Pause* Es ist verschlossen.;Hmmm. *Pause* C'est verrouillé.;Hmmm. *Pausa* È chiuso.;Hmmm. *Zatrzymuje się* Drzwi są zamknięte.;Хмм. *Пауза* Дверь заперта.;嗯。*暂停* 门锁上了。;嗯。*暫停* 門鎖上了。;うーん。*一時停止* ドアがロックされています。;흠. *잠시 멈춤* 문이 잠겼어.;हम्म। *ठहराव* दरवाजा बंद है।;هممم. *توقف* الباب مغلق.;হুম। *থেমে যায়* দরজা লক করা হয়েছে।;Hmm. *Berhenti sejenak* Pintu terkunci.;ฮึม. *หยุด* ประตูล็อคแล้ว.;Hừm. *tạm dừng* Cửa bị khóa.
