CHAR ID;CHAR NAMES;KEYS;Turkish;English;Spanish;Portuguese;German;French;Italian;Polish;Russian;ChineseSimplified;ChineseTraditional;Japanese;Korean;Indian;Arabic;Bengali;Indonesian;Thai;Vietnamese
1;Althea;expRoom_WhoIsAlthea;Althea mı? Althea kim ki? Benim adım mı?;Althea? Who is Althea? Is it my name?;¿Althea? ¿Quién es Althea? ¿Es mi nombre?;Althea? Quem é Althea? É o meu nome?;Althea? Wer ist Althea? Ist das mein Name?;Althea? Qui est Althea? Est-ce mon nom?;Althea? Chi è Althea? È il mio nome?;Althea? Kim jest Althea? Czy to moje imię?;Альтея? Кто такая Альтея? Это моё имя?;阿尔西亚？阿尔西亚是谁？是我的名字吗？;阿爾西亞？阿爾西亞是誰？是我的名字嗎？;アルシア？アルシアって誰？私の名前？;알테아? 알테아가 누구지? 내 이름인가?;अल्थिया? अल्थिया कौन है? क्या यह मेरा नाम है?;ألثيا؟ من هي ألثيا؟ هل هو اسمي؟;আলথিয়া? আলথিয়া কে? এটি কি আমার নাম?;Althea? Siapa Althea? Apakah itu nama saya?;อัลเธีย? อัลเธียคือใคร? นั่นชื่อของฉันเหรอ?;Althea? Althea là ai? Đó có phải là tên của tôi không?
1;Althea;expRoom_WhatWhatIsHappening;Ne? Neler oluyor?!;What? What's happening?!;¿Qué? ¡¿Qué está pasando?!;O quê? O que está acontecendo?!;Was? Was passiert hier?!;Quoi? Que se passe-t-il?!;Cosa? Che sta succedendo?!;Co? Co się dzieje?!;Что? Что происходит?!;什么？发生了什么？！;什麼？發生了什麼？！;何？何が起きているの？！;뭐? 무슨 일이야?!;क्या? क्या हो रहा है?!;ماذا؟ ماذا يحدث؟!;কি? কি ঘটছে?!;Apa? Apa yang sedang terjadi?!;อะไร? เกิดอะไรขึ้น?!;Gì? Điều gì đang xảy ra?!
1;Althea;expRoom_letmeout;*korkar* Bırakın beni!;*scared* Let me out!;*Asustado* ¡Déjenme salir!;*Assustado* Me deixem sair!;*Erschrocken* Lasst mich raus!;*Effrayé* Laissez-moi sortir!;*Spaventato* Fatemi uscire!;*Przestraszony* Wypuśćcie mnie!;*Напуганный* Выпустите меня!;*害怕* 放我出去！;*害怕* 放我出去！;*怖がる* 出してくれ！;*겁에 질려* 나를 내보내줘!;*डरा हुआ* मुझे बाहर जाने दो!;*خائف* أخرجني!;*ভীত* আমাকে যেতে দিন!;*Takut* Biarkan aku keluar!;*ตกใจ* ปล่อยฉันออกไป!;*Sợ hãi* Thả tôi ra!
1;Althea;expRoom_letmeoutpls;*korkar* *ağlar* Bırakın beni! Lütfen, bırakın beni!;*scared* *crying* Let me out! Please, let me out!;*Asustado* *Llorando* ¡Déjenme salir! ¡Por favor, déjenme salir!;*Assustado* *Chorando* Me deixem sair! Por favor, me deixem sair!;*Erschrocken* *Weint* Lasst mich raus! Bitte, lasst mich raus!;*Effrayé* *Pleurant* Laissez-moi sortir! S'il vous plaît, laissez-moi sortir!;*Spaventato* *Piangendo* Fatemi uscire! Per favore, fatemi uscire!;*Przestraszony* *Płacze* Wypuśćcie mnie! Proszę, wypuśćcie mnie!;*Напуганный* *Плачет* Выпустите меня! Пожалуйста, выпустите меня!;*害怕* *哭泣* 放我出去！拜托，放我出去！;*害怕* *哭泣* 放我出去！拜託，放我出去！;*怖がる* *泣く* 出してくれ！お願いだから、出してくれ！;*겁에 질려* *울며* 나를 내보내줘! 제발, 나를 내보내줘!;*डरा हुआ* *रोते हुए* मुझे बाहर जाने दो! कृपया, मुझे बाहर जाने दो!;*خائف* *يبكي* أخرجني! من فضلك، أخرجني!;*ভীত* *কাঁদছে* আমাকে যেতে দিন! দয়া করে, আমাকে যেতে দিন!;*Takut* *Menangis* Biarkan aku keluar! Tolong, biarkan aku keluar!;*ตกใจ* *ร้องไห้* ปล่อยฉันออกไป! ได้โปรดปล่อยฉันออกไป!;*Sợ hãi* *Khóc* Thả tôi ra! Làm ơn, thả tôi ra!
1;Althea;expRoom_ISaidLETMEOUT;*sinirli* BENİ-BIRAKIN-DEDİM!;*angry* I SAID LET-ME-OUT!;*Enojado* ¡DIJE SUÉLTAME!;*Zangado* EU DISSE DEIXE-ME SAIR!;*Wütend* ICH SAGTE LASS-MICH-RAUS!;*En colère* J'AI DIT LAISSE-MOI SORTIR!;*Arrabbiato* HO DETTO LASCIAMI USCIRE!;*Zdenerwowany* POWIEDZIAŁEM WYPUŚĆ-MNIE!;*Злой* Я СКАЗАЛ ВЫПУСТИТЕ-МЕНЯ!;*生气* 我说了放开我！;*生氣* 我說了放開我！;*怒り* 出してくれと言っただろ！;*화가 난* 내보내라고 했잖아!;*गुस्से में* मैंने कहा मुझे बाहर जाने दो!;*غاضب* قلت أخرجني!;*রাগান্বিত* আমি বলেছি আমাকে যেতে দাও!;*Marah* Saya bilang biarkan saya keluar!;*โกรธ* ฉันบอกว่าให้ฉันออกไป!;*Tức giận* Tôi nói thả tôi ra!
;;expRoom_youBrokeIronDoor;*Demir kapı kırıldı*;*She broke the iron door.*;*La puerta de hierro se rompió.*;*Ela quebrou a porta de ferro.*;*Sie hat die Eisentür zerbrochen.*;*Elle a cassé la porte en fer.*;*Ha rotto la porta di ferro.*;*Złamała żelazne drzwi.*;*Она сломала железную дверь.*;*她打破了铁门。*;*她打破了鐵門。*;*彼女は鉄のドアを壊しました。*;*그녀는 철문을 부쉈다.*;*उसने लोहे का दरवाजा तोड़ दिया।*;*لقد كسرت الباب الحديدي.*;*সে লোহার দরজা ভেঙে ফেলেছে।*;*Dia menghancurkan pintu besi.*;*เธอทำลายประตูเหล็ก*;*Cô ấy phá hỏng cánh cửa sắt.*
1;Althea;expRoom_thatWasScary;Bu çok korkutucuydu!;That was so scary!;¡Eso fue tan aterrador!;Isso foi tão assustador!;Das war so gruselig!;C'était tellement effrayant!;È stato così spaventoso!;To było takie przerażające!;Это было так страшно!;那太可怕了！;那太可怕了！;それはとても怖かった！;그건 정말 무서웠어!;वह बहुत डरावना था!;كان ذلك مخيفًا جدًا!;এটা খুব ভীতিকর ছিল!;Itu sangat menakutkan!;น่ากลัวมาก!;Điều đó thật đáng sợ!
1;Althea;expRoom_calmPeaceful;Buranın sakin ve barışçıl bir yer olduğunu düşünmüştüm. Sanırım yanılmışım.;I thought this place was supposed to be calm and peaceful. Guess I was wrong.;Pensé que este lugar se suponía que era tranquilo y pacífico. Supongo que me equivoqué.;Eu pensei que este lugar deveria ser calmo e pacífico. Acho que estava errado.;Ich dachte, dieser Ort sollte ruhig und friedlich sein. Ich schätze, ich lag falsch.;Je pensais que cet endroit était censé être calme et paisible. Je suppose que je me suis trompé.;Pensavo che questo posto dovesse essere calmo e pacifico. Immagino di essermi sbagliato.;Myślałem, że to miejsce miało być spokojne i ciche. Chyba się myliłem.;Я думал, что это место должно быть спокойным и мирным. Похоже, я ошибался.;我以为这个地方应该是平静和平和的。我想我错了。;我以為這個地方應該是平靜和平和的。我想我錯了。;この場所は落ち着いて平和であるべきだと思っていました。間違っていたようです。;나는 이곳이 평화롭고 고요한 곳일 거라고 생각했어. 내가 틀렸나봐.;मुझे लगा कि यह जगह शांत और शांतिपूर्ण होनी चाहिए। लगता है मैं गलत था।;كنت أعتقد أن هذا المكان من المفترض أن يكون هادئًا وسلميًا. أعتقد أنني كنت مخطئًا.;আমি ভেবেছিলাম এই জায়গাটি শান্ত এবং শান্তিপূর্ণ হওয়া উচিত। মনে হয় আমি ভুল ছিলাম।;Saya pikir tempat ini seharusnya tenang dan damai. Kurasa aku salah.;ฉันคิดว่าสถานที่นี้ควรจะสงบและเงียบสงบ ฉันคงคิดผิด;Tôi nghĩ nơi này đáng lẽ phải yên bình và tĩnh lặng. Hình như tôi đã sai.
1;Althea;theyLookSoBeautiful;Çok güzel görünüyorlar!;They look so beautiful!;¡Se ven tan hermosos!;Eles parecem tão bonitos!;Sie sehen so schön aus!;Ils sont si beaux!;Sembrano così belli!;Wyglądają tak pięknie!;Они выглядят так красиво!;他们看起来好漂亮！;他們看起來好漂亮！;彼らはとても美しく見えます！;그들은 정말 아름다워 보여!;वे बहुत सुंदर दिखते हैं!;إنهم يبدون رائعين جدًا!;তারা দেখতে খুব সুন্দর!;Mereka terlihat sangat cantik!;พวกเขาดูสวยงามมาก!;Họ trông thật đẹp!
1;Althea;theyLookAlmostAlive;Sanki canlı gibiler!;They almost look alive!;¡Casi parecen vivos!;Eles quase parecem vivos!;Sie sehen fast lebendig aus!;Ils ont presque l'air vivants!;Sembrano quasi vivi!;Wyglądają prawie jak żywe!;Они почти выглядят живыми!;他们看起来几乎像活的一样！;他們看起來幾乎像活的一樣！;彼らはほとんど生きているように見えます！;그들은 거의 살아 있는 것 같아 보여!;वे लगभग जीवित दिखते हैं!;إنهم يبدون شبه أحياء!;তারা প্রায় জীবিত মনে হয়!;Mereka hampir terlihat hidup!;พวกเขาดูเหมือนมีชีวิต!;Họ gần như trông sống động!
;;narrativePauses;*duraksar*;*pauses*;*Pausa*;*Pausa*;*Pausiert*;*Pause*;*Pausa*;*Zatrzymuje się*;*Пауза*;*暂停*;*暫停*;*一時停止*;*멈춤*;*रुकता है*;*يتوقف*;*থামে*;*Berhenti*;*หยุดชั่วคราว*;*Tạm dừng*
1;Althea;areTheyAlive;Bekle, bunlar…canlı mı?;Wait, are they...alive?!;Espera, ¿están... vivos?;Espere, eles estão... vivos?!;Warte, sind sie... lebendig?!;Attends, sont-ils... vivants?!;Aspetta, sono... vivi?!;Czekaj, czy oni są... żywi?!;Подожди, они... живые?!;等等，他们……活着吗？！;等等，他們……活著嗎？！;待って、彼らは…生きているの？！;잠깐, 이들은... 살아 있는 건가?!;रुको, क्या वे... जीवित हैं?!;انتظر، هل هم... أحياء؟!;অপেক্ষা কর, তারা কি... জীবিত?!;Tunggu, apakah mereka... hidup?!;เดี๋ยวก่อน พวกเขา... มีชีวิตอยู่เหรอ?!;Chờ đã, họ... sống sao?!
1;Althea;extremelySmooth;Özellikle bu baktığım. Aşırı pürüzsüz görünüyor.;Especially this one. It looks extremely smooth.;Especialmente este. Se ve extremadamente suave.;Especialmente este. Parece extremamente liso.;Besonders dieses hier. Es sieht extrem glatt aus.;Surtout celui-ci. Il a l'air extrêmement lisse.;Soprattutto questo. Sembra estremamente liscio.;Szczególnie ten. Wygląda niezwykle gładko.;Особенно этот. Он выглядит чрезвычайно гладким.;尤其是这个。看起来非常光滑。;尤其是這個。看起來非常光滑。;特にこれ。非常に滑らかに見えます。;특히 이거. 정말 매끈해 보여.;विशेष रूप से यह। यह अत्यधिक चिकना दिखता है।;خاصة هذا. يبدو ناعمًا للغاية.;বিশেষ করে এটি। এটি অত্যন্ত মসৃণ দেখাচ্ছে।;Khususnya yang ini. Terlihat sangat halus.;โดยเฉพาะอันนี้ ดูราบเรียบมาก;Đặc biệt là cái này. Trông rất mượt mà.
1;Althea;notEvenSnow;Sanki kardan yapılmamış gibi.;It’s like it’s not even made of snow.;Es como si no estuviera hecho de nieve.;É como se nem fosse feito de neve.;Es ist, als ob es nicht einmal aus Schnee gemacht wäre.;C'est comme si ce n'était même pas fait de neige.;È come se non fosse nemmeno fatto di neve.;To tak, jakby nie było nawet zrobione ze śniegu.;Как будто это даже не сделано из снега.;看起来好像不是雪做的。;看起來好像不是雪做的。;雪でできているようには見えません。;눈으로 만들어진 것 같지 않아.;ऐसा लगता है जैसे यह बर्फ से बना भी नहीं है।;إنه يبدو وكأنه ليس مصنوعًا من الثلج.;এটি তুষার থেকে তৈরি বলে মনে হচ্ছে না।;Sepertinya itu bahkan tidak terbuat dari salju.;ดูเหมือนว่ามันไม่ได้ทำจากหิมะ;Trông như nó thậm chí không được làm từ tuyết.
;;touches;*dokunur*;*touches*;*Toca*;*Toca*;*Berührt*;*Touche*;*Tocca*;*Dotyka*;*Касается*;*触摸*;*觸摸*;*触れる*;*만지다*;*छूता है*;*يلمس*;*স্পর্শ করে*;*Menyentuh*;*สัมผัส*;*Chạm*
1000;RobotSnowman;snowmanDangerDetect;TEHLİKE! TEHLİKE! Deneyin kaçtığı tespit edildi!;DANGER! DANGER! The experiment has been detected escaping.;¡PELIGRO! ¡PELIGRO! Se ha detectado que el experimento está escapando.;PERIGO! PERIGO! Foi detectado que o experimento está escapando.;GEFAHR! GEFAHR! Das Experiment wurde beim Entkommen entdeckt.;DANGER! DANGER! L'expérience a été détectée en train de s'échapper.;PERICOLO! PERICOLO! L'esperimento è stato rilevato mentre scappava.;NIEBEZPIECZEŃSTWO! NIEBEZPIECZEŃSTWO! Wykryto, że eksperyment ucieka.;ОПАСНОСТЬ! ОПАСНОСТЬ! Эксперимент был обнаружен при побеге.;危险！危险！检测到实验逃跑。;危險！危險！檢測到實驗逃跑。;危険！危険！実験が脱出しようとしていることが検出されました。;위험! 위험! 실험이 탈출 중임이 감지되었습니다.;खतरा! खतरा! प्रयोग का भागना पता चला है।;خطر! خطر! تم الكشف عن محاولة التجربة الهروب.;বিপদ! বিপদ! পরীক্ষা পালিয়ে যাওয়া সনাক্ত করা হয়েছে।;BAHAYA! BAHAYA! Eksperimen terdeteksi melarikan diri.;อันตราย! อันตราย! ตรวจพบการทดลองหลบหนี.;NGUY HIỂM! NGUY HIỂM! Thí nghiệm được phát hiện đang trốn thoát.
1000;RobotSnowman;snowmanSelfDestruct;Kaçışın devamını engellemek için, kendini imha protokolü başlatıldı.;To prevent further escape, the self destruction protocol has been initiated.;Para prevenir más escapes, se ha iniciado el protocolo de autodestrucción.;Para evitar mais fugas, o protocolo de autodestruição foi iniciado.;Um weitere Flucht zu verhindern, wurde das Selbstzerstörungsprotokoll aktiviert.;Pour prévenir toute évasion supplémentaire, le protocole d'autodestruction a été déclenché.;Per prevenire ulteriori fughe, è stato avviato il protocollo di autodistruzione.;Aby zapobiec dalszej ucieczce, uruchomiono protokół samozniszczenia.;Чтобы предотвратить дальнейший побег, был запущен протокол самоуничтожения.;为防止进一步逃跑，已启动自毁协议。;為防止進一步逃跑，已啟動自毀協議。;逃亡を防ぐために、自爆プロトコルが発動されました。;도주를 막기 위해 자폭 프로토콜이 시작되었습니다.;अधिक भागने से रोकने के लिए, आत्म-विनाश प्रोटोकॉल शुरू किया गया है।;لمنع المزيد من الهروب، تم بدء بروتوكول التدمير الذاتي.;আরও পালানোর প্রতিরোধ করতে, আত্মবিধ্বংস প্রোটোকল শুরু করা হয়েছে।;Untuk mencegah pelarian lebih lanjut, protokol penghancuran diri telah dimulai.;เพื่อป้องกันการหลบหนีเพิ่มเติม ได้เริ่มต้นโปรโตคอลทำลายตัวเองแล้ว;Để ngăn chặn việc trốn thoát thêm nữa, giao thức tự hủy đã được kích hoạt.
1;Althea;althWaitSelfDestruct;bekle. Bekle! Dur biraz! Kendini imha protokolü derken ne demek istiyorsun?;wait. Wait! Hold on! What do you mean self destruction?!;espera. ¡Espera! ¡Espera un momento! ¿Qué quieres decir con autodestrucción?!;espera. Espere! O que você quer dizer com autodestruição?!;Warte. Warte! Was meinst du mit Selbstzerstörung?!;Attends. Attends! Qu'entends-tu par autodestruction?!;Aspetta. Aspetta! Cosa intendi per autodistruzione?!;Poczekaj. Poczekaj! Co masz na myśli przez samozniszczenie?!;Подожди. Подожди! Что ты имеешь в виду под самоуничтожением?!;等等。等等！自我毁灭是什么意思？！;等等。等等！自我毀滅是什麼意思？！;待って。待って！自己破壊ってどういう意味？！;잠깐. 잠깐! 자폭이 무슨 뜻이야?!;रुको। रुको! आत्म-विनाश से आपका क्या मतलब है?!;انتظر. انتظر! ماذا تعني بالتدمير الذاتي؟!;অপেক্ষা করো। অপেক্ষা করো! আত্মবিধ্বংস বলতে তুমি কী বোঝাতে চাও?!;Tunggu. Tunggu! Apa maksudmu dengan penghancuran diri?!;เดี๋ยวก่อน เดี๋ยวก่อน! คุณหมายถึงการทำลายตัวเองอย่างไร?!;Chờ đã. Chờ đã! Bạn nói gì về tự hủy?!
;;narrativeSnowmanExplodes;*Kardan adam patlar*;*The snowman explodes.*;*El muñeco de nieve explota.*;*O boneco de neve explode.*;*Der Schneemann explodiert.*;*Le bonhomme de neige explose.*;*Il pupazzo di neve esplode.*;*Bałwan wybucha.*;*Снеговик взрывается.*;*雪人爆炸了。*;*雪人爆炸了。*;*雪だるまが爆発する。*;*눈사람이 폭발하다.*;*स्नोमैन विस्फोट करता है।*;*رجل الثلج ينفجر.*;*তুষারমানব ফেটে যায়।*;*Manusia salju meledak.*;*ตุ๊กตาหิมะระเบิด*;*Người tuyết phát nổ.*
;;narrativeFearFaint;*Bayılacak gibi hissediyor. Acıdan değil, korkudan dolayı!*;*She feels as though she is about to faint. Not from pain, but from fear!*;*Siente como si estuviera a punto de desmayarse. No por dolor, sino por miedo!*;*Ela sente como se estivesse prestes a desmaiar. Não de dor, mas de medo!*;*Sie fühlt sich, als würde sie gleich ohnmächtig werden. Nicht vor Schmerz, sondern vor Angst!*;*Elle sent qu'elle est sur le point de s'évanouir. Pas de douleur, mais de peur!*;*Sente come se stesse per svenire. Non per il dolore, ma per la paura!*;*Czuje się, jakby miała zemdleć. Nie z bólu, ale ze strachu!*;*Она чувствует, что вот-вот упадёт в обморок. Не от боли, а от страха!*;*她感觉自己快要晕倒了，不是因为疼痛，而是因为恐惧！*;*她感覺自己快要暈倒了，不是因為疼痛，而是因為恐懼！*;*彼女は痛みではなく、恐怖から気を失いそうに感じている。*;*고통이 아니라 두려움 때문에 기절할 것 같다.*;*वह ऐसा महसूस करती है जैसे वह बेहोश होने वाली है। दर्द से नहीं, बल्कि डर से!*;*تشعر وكأنها على وشك الإغماء. ليس من الألم، ولكن من الخوف!*;*সে মনে করছে যে সে জ্ঞান হারাতে চলেছে। ব্যথার জন্য নয়, ভয়ের জন্য!*;*Dia merasa seolah-olah dia akan pingsan. Bukan karena rasa sakit, tetapi karena ketakutan!*;*เธอรู้สึกเหมือนกำลังจะเป็นลม ไม่ใช่เพราะความเจ็บปวด แต่เพราะความกลัว!*;*Cô ấy cảm thấy như sắp ngất xỉu. Không phải vì đau đớn, mà vì sợ hãi!*
;;narrativeFearNeverExp;*O, böyle bir korkuyu daha önce hiç hissetmemişti.*;*This is a level of fear she has never experienced before.*;*Este es un nivel de miedo que nunca antes había experimentado.*;*Este é um nível de medo que ela nunca experimentou antes.*;*Dies ist ein Maß an Angst, das sie noch nie zuvor erlebt hat.*;*C'est un niveau de peur qu'elle n'a jamais ressenti auparavant.*;*Questo è un livello di paura che non ha mai provato prima.*;*To jest poziom strachu, którego nigdy wcześniej nie doświadczyła.*;*Это уровень страха, который она никогда не испытывала раньше.*;*这是她从未经历过的恐惧级别。*;*這是她從未經歷過的恐懼級別。*;*これは彼女がこれまでに経験したことのない恐怖のレベルです。*;*그녀가 전에 경험해 본 적이 없는 공포 수준이다.*;*यह भय का ऐसा स्तर है जिसे उसने पहले कभी अनुभव नहीं किया है।*;*هذا مستوى من الخوف لم تختبره من قبل.*;*এটি এমন একটি ভয়ের স্তর যা সে আগে কখনও অনুভব করেনি।*;*Ini adalah tingkat ketakutan yang belum pernah dia alami sebelumnya.*;*นี่คือระดับของความกลัวที่เธอไม่เคยสัมผัสมาก่อน*;*Đây là mức độ sợ hãi mà cô ấy chưa từng trải qua trước đây.*
;;narrativeGoingIntoShock;*Şoka giriyor*;*She is going into shock.*;*Ella está entrando en estado de shock.*;*Ela está entrando em choque.*;*Sie gerät in einen Schockzustand.*;*Elle est en état de choc.*;*Sta andando in stato di shock.*;*Wpada w szok.*;*Она впадает в шок.*;*她进入了休克状态。*;*她進入了休克狀態。*;*彼女はショック状態に陥っています。*;*그녀는 쇼크 상태에 빠지고 있다.*;*वह सदमे में जा रही है।*;*إنها تدخل في حالة صدمة.*;*সে শোকের মধ্যে প্রবেশ করছে।*;*Dia dalam keadaan terkejut.*;*เธอกำลังเข้าสู่ภาวะช็อก*;*Cô ấy đang rơi vào trạng thái sốc.*
1;Althea;althImOnFire;OH HAYIR! YANIYORUM!;OH NO! I’M ON FIRE!;¡OH NO! ¡ESTOY EN LLAMAS!;OH NÃO! ESTOU EM CHAMAS!;OH NEIN! ICH BIN IN FLAMMEN!;OH NON! JE SUIS EN FEU!;OH NO! STO PRENDENDO FUOCO!;O NIE! PŁONĘ!;О НЕТ! Я В ОГНЕ!;哦不！我着火了！;哦不！我著火了！;ああ、なんてことだ！私は燃えている！;오 안돼! 나 불붙었어!;ओह नहीं! मैं जल रहा हूँ!;أوه لا! أنا مشتعلة!;ওহ না! আমি জ্বলছি!;OH TIDAK! AKU TERBAKAR!;โอ้ไม่! ฉันไฟลุกท่วม!;Ôi không! Tôi đang bốc cháy!
1;Althea;althThisCantBeHappening;HAYIR BU GERÇEK OLAMAZ!;THIS CAN'T BE HAPPENING!;¡ESTO NO PUEDE ESTAR SUCEDIENDO!;ISSO NÃO PODE ESTAR ACONTECENDO!;DAS KANN NICHT PASSIEREN!;CE N'EST PAS POSSIBLE!;QUESTO NON PUÒ STARE ACCADENDO!;TO NIE MOŻE SIĘ DZIAĆ!;ЭТО НЕ МОЖЕТ БЫТЬ!;这不可能发生！;這不可能發生！;これはありえない！;이럴 수가 없어!;यह नहीं हो सकता!;هذا لا يمكن أن يحدث!;এটি ঘটতে পারে না!;INI TIDAK MUNGKIN TERJADI!;นี่มันเกิดขึ้นไม่ได้!;Điều này không thể xảy ra!
1;Althea;althThisCant;bu olamaz-;this can't-;esto no puede-;isto não pode-;das kann nicht-;ce n'est pas possible-;questo non può-;to nie może-;это не может быть-;这不可能-;這不可能-;これはありえない-;이럴 수가-;यह नहीं हो सकता-;هذا لا يمكن أن-;এটি হতে পারে না-;ini tidak bisa-;นี่มันไม่-;điều này không thể-
